Name,State/UT,Type,Historical/Cultural Background,Uniqueness Factor,Things to Do,How to Get There,Accessibility Info,Best Time to Visit,Accommodation Options,Local Cuisine Specialties,Cultural Events
Cholanaickan Tribal Settlement,Kerala,Cultural,Home to one of India's most isolated tribes who lived in caves until recently. They are master honey gatherers and forest knowledge experts.,One of the last hunter-gatherer communities in South India with extensive knowledge of medicinal plants. Their language is unique and not written down.,Guided visits to forest periphery with tribal guides; learning about honey collection; medicinal plant walks; cultural exchange programs through government-sanctioned tribal welfare initiatives.,"60 km from Nilambur, Kerala. Nearest airport is Kozhikode; nearest railway station is Nilambur Road.",Not suitable for elderly or wheelchair users; visits only with official permission and guides; not for independent travelers.,December-April,No accommodations in tribal areas; stay in Nilambur or nearby areas,"Traditional tribal food includes tubers, wild honey, bamboo rice, and foraged greens",No public festivals; occasional cultural programs organized by Tribal Department
Dong Village,Arunachal Pradesh,Natural,"Easternmost village in India where the sun rises first in the country. Located near the tri-junction of India, China, and Myanmar borders.",First place in India to receive sunlight each morning (around 5:30 AM). Traditional Meyor tribe settlement with unique cultural practices influenced by Tibetan Buddhism.,Experience India's earliest sunrise; village walks; photography; bird watching; learning about Meyor culture; trekking along nearby hills; visit to Dong Monastery.,50 km from Walong. Nearest airport is Dibrugarh (connection via road/helicopter); permits required for all visitors.,Challenging for elderly and not wheelchair accessible; inner line permits required; guided tours essential.,March-May and October-November,Basic homestays in the village; government inspection bungalow with prior booking,Thukpa; momos; local rice preparations; fermented bamboo shoot dishes; butter tea,Buddhist festivals following Tibetan calendar; Losar celebrations
Ziro Valley,Arunachal Pradesh,Natural,Home to the Apatani tribe known for their unique face tattoos and nose plugs. UNESCO World Heritage Site contender.,One of India's few rice-cum-fish cultivation systems. The valley has distinctive bamboo and pine forests with picturesque villages.,Trekking in the valley floor; attending Ziro Music Festival (September); photography of paddy fields; homestay with Apatani tribe; exploring Talley Valley Wildlife Sanctuary.,Nearest airport is Jorhat (Assam) 4 hours away. Helicopter service from Naharlagun to Ziro. Train to Naharlagun then taxi to Ziro.,Moderate difficulty for elderly; not wheelchair accessible; safe for solo travelers with basic precautions.,April-June and September-October,Homestays in traditional Apatani houses; Ziro Valley Resort; few guest houses in Old Ziro and New Ziro,Bamboo shoots with pork; fermented rice beer (apong); smoked meat dishes; fish from paddy fields,Ziro Music Festival (September); Myoko Festival (March); Dree Festival (July)
Majuli Island,Assam,Cultural,World's largest river island on the Brahmaputra. Center of Assamese neo-Vaishnavite culture with ancient monasteries (satras) dating back to the 15th century.,Unique tradition of mask-making at Samaguri Satra. The island is gradually eroding due to the Brahmaputra river and may disappear in coming decades.,Visit ancient satras (monasteries); watch mask-making process; bicycle around the island; boat rides on the Brahmaputra; bird watching during winter; cultural performances at satras.,Ferry from Nimati Ghat (Jorhat) to Kamalabari Ghat. Nearest airport is Jorhat; nearest railway station is Jorhat.,Limited accessibility for disabled visitors; senior-friendly with assistance; safe for solo travelers.,October-March,La Maison de Ananda; Me:Po Okum; Deka Chang; numerous homestays,Assamese thalis with fresh fish; poitabhat (fermented rice); duck meat with ash gourd,Raas Leela (November); Paal Naam performances at satras; Ali-Ai-Ligang (February)
Champaner-Pavagadh Archaeological Park,Gujarat,Cultural,UNESCO World Heritage Site with structures dating from the 8th to 14th centuries. Ancient Hindu and Jain temples along with Islamic monuments.,Only complete unchanged pre-Mughal Islamic city in India. Contains ruins from multiple periods showcasing evolution of architectural styles over 600 years.,Explore Jami Masjid; hike to Pavagadh Hill and Kalika Mata Temple; visit the step wells; photography of ancient structures; archeological explorations of lesser-known ruins.,57 km from Vadodara. Nearest airport and railway station is Vadodara.,Moderately accessible for elderly; partial wheelchair access in main monuments; solo travel friendly.,October-March,Limited options near the site. Best to stay in Vadodara and make a day trip.,Gujarati thali; dhokla; khandvi; dal dhokli available in nearby small eateries,Navratri celebrations at Kalika Mata Temple (September/October)
Unakoti,Tripura,Cultural,Rock-cut sculptures and stone images from 7th-9th centuries depicting Lord Shiva and other Hindu deities. The name means 'one less than a crore' in Bengali.,Features massive 30-foot high bas-relief carvings on a hillside. Legend says these are divine artisans turned to stone after failing to create a crore sculptures in one night.,Explore the massive rock carvings; photography; meditation in the serene environment; hiking around the forested area; visit nearby waterfalls.,178 km from Agartala. Nearest railhead is Kumarghat (20 km). Nearest airport is Agartala.,Challenging for elderly and wheelchair users due to hillside location and steps; reasonable for solo travelers.,October-March,Limited accommodations in Kailashahar (12 km away); better options in Agartala,Traditional Tripuri cuisine; bamboo shoot preparations; berma (fermented fish); chuak (rice beer),Ashokastami Festival (April) when thousands of pilgrims visit
Hemis National Park,Ladakh,Natural,Largest national park in South Asia and home to the endangered snow leopard. Established in 1981 but the area has ancient Buddhist connections.,One of the best places in the world to spot the elusive snow leopard. Also houses ancient monasteries amid stunning high-altitude Himalayan landscapes.,Wildlife spotting (snow leopards from Jan-Mar); trekking; visit to Hemis Monastery; photography; homestay in traditional Ladakhi houses in Rumbak village.,40 km from Leh. Nearest airport is Leh. Entry through organized tours only with permits.,Not suitable for elderly or wheelchair users; moderate to difficult trekking; experienced solo travelers only with guides.,Winter (Jan-Mar) for snow leopards; summer (May-Sep) for trekking and general exploration,Homestays in Rumbak village; camping during treks; no luxury accommodations inside the park,Thukpa; skyu; chhutagi; butter tea; chang (barley beer),Hemis Festival at Hemis Monastery (June/July)
Chettinad,Tamil Nadu,Cultural,Historical region known for the palatial houses of the wealthy Nattukottai Chettiar merchant community who traded across Southeast Asia.,"Mansions built with materials from around the world including Italian marble, Japanese tiles, and Burmese teak. Unique architectural style blending Western and Eastern influences.",Mansion tours in Karaikudi; antique shopping; Chettinad cuisine experiences; photography of architectural details; tile-making workshops; temple visits.,Nearest airport is Madurai (90 km); nearest railway station is Karaikudi.,Suitable for elderly with assistance; limited wheelchair accessibility in old mansions; safe for solo travelers.,November-February,The Bangala; Visalam; Chidambara Vilas; Chettinadu Mansion - all heritage hotels converted from original mansions,Chettinad chicken/mutton; Kavuni arisi (black rice pudding); paniyaram; vegetable kothu; kuzhi paniyaram,Kothaipongal (January); local temple festivals throughout year
Dzukou Valley,Nagaland,Natural,Valley on the border of Nagaland and Manipur at an altitude of 2450m. Traditional territory of the Angami Naga tribe.,Famous for its seasonal burst of lilies and rare Dzukou lily found nowhere else in the world. Features uniquely sculpted valleys and rolling hills with dwarf bamboo patches.,Trekking; camping; photography especially during lily season (May-September); botanizing; star gazing; experiencing Naga culture in nearby villages.,Trek starts from Viswema or Zakhama village. Nearest airport and railway station is Dimapur (100 km from Kohima).,Challenging for elderly and not wheelchair accessible; experienced trekkers recommended; guided tours advisable for solo travelers.,May-September for lilies; October-April for clear views,Basic accommodations at rest house in the valley; camping; better options in Kohima,Smoked pork with bamboo shoot; axone (fermented soybean); zutho (rice beer); fish cooked in bamboo,Hornbill Festival (December) in nearby Kohima; Sekrenyi Festival (February)
Gurez Valley,Jammu & Kashmir,Natural,Remote valley near the Line of Control that was closed to tourists until recently. Inhabited by the Dard-Shin tribe who have preserved their unique culture.,One of the few places where the ancient Shina language is still spoken. Spectacular views of snow-capped Habba Khatoon peak and the Kishanganga River.,Trout fishing in Kishanganga River; trekking to Tulail Valley; visiting ancient Habba Khatoon tower; photography; cultural exploration of Dard-Shin traditions; homestays.,123 km from Srinagar. Nearest airport is Srinagar. Road access only during summer months (May-October).,Not suitable for elderly or wheelchair users; requires security clearances as it's near LOC; solo travel possible but challenging.,June-September,J&K Tourism guest house; homestays in Dawar village; camping options,Gurez trout preparations; rajma-chawal; noon chai (salt tea); traditional Dard-Shin dishes,Local folk dance performances in summer; Peer Baba festival at Habba Khatoon shrine
Mechuka Valley,Arunachal Pradesh,Natural,"A remote valley near the Indo-Tibet border, home to the Memba tribe and a 400-year-old Buddhist monastery.","Pristine landscapes, wooden houses, and a unique blend of Buddhist and tribal cultures.","Trekking, monastery visits, river rafting, explore local villages.","Nearest airport is Dibrugarh (Assam), then 7-8 hr drive. Permits required.",Not wheelchair accessible; basic facilities only.,October-February,Homestays and guesthouses in Mechuka town.,"Momo, thukpa, local millet beer.",Losar (Tibetan New Year) celebrations.
Haflong,Assam,Natural,"Assam's only hill station, known for its scenic beauty, Dimasa culture, and Haflong Lake.","Rolling hills, tribal villages, and orchid gardens.","Boating on Haflong Lake, trekking, visiting Jatinga (famous for bird phenomenon).",Nearest railhead is Haflong Hill; Silchar airport 100 km away.,Good for all ages; some hilly terrain.,"March-June, September-October","Haflong Circuit House, local homestays.","Sticky rice, bamboo shoot dishes, fish curry.",Dimasa Baidima Festival.
Tawang Monastery,Arunachal Pradesh,Cultural,"Largest monastery in India, founded in the 17th century. Center of Mahayana Buddhism in the region.","Spectacular hilltop setting, rich monastic traditions.","Attend morning prayers, explore museum, trek to nearby lakes.","Nearest airport is Tezpur, then 12 hr drive; permits required.",Not wheelchair accessible; high altitude.,"March-May, October-November","Monastery guesthouse, local hotels.","Thenthuk, butter tea, yak cheese.",Torgya Festival (January).
Sandakphu,West Bengal,Natural,"Highest peak in West Bengal, part of Singalila Ridge, offering panoramic views of four of the world's five highest peaks.","Only place in India to see Everest, Kanchenjunga, Lhotse, and Makalu together.","Trekking, rhododendron watching, birding.",Trek from Manebhanjan (near Darjeeling); nearest airport is Bagdogra.,Not suitable for elderly or wheelchair users.,"April-June, September-November","Tea houses, trekkers' huts.","Darjeeling tea, momos.",Local Lepcha festivals.
Chopta,Uttarakhand,Natural,"Known as the 'Mini Switzerland of India', Chopta is the base for the Tungnath trek, the highest Shiva temple.","Alpine meadows, rhododendron forests, and Himalayan views.","Trekking to Tungnath and Chandrashila, camping, bird watching.",Drive from Rishikesh/Haridwar (200 km); nearest railhead is Haridwar.,"Basic guesthouses, some tented camps.","March-June, September-November","Guesthouses in Chopta, camping.","Aloo ke gutke, mandua roti.",Butter Festival (August).
Chakrata,Uttarakhand,Natural,"A cantonment town established by the British, surrounded by deodar forests.",Secluded hill station with ancient caves and waterfalls.,"Visit Tiger Falls, Deoban, Budher Caves, trekking.",100 km from Dehradun; nearest airport is Jolly Grant.,Good for families; some sites require trekking.,October-March,"Forest rest houses, homestays.","Kandali ka saag, local rajma.",Magh Mela.
Lonar Crater,Maharashtra,Natural,"A 52,000-year-old meteorite crater lake, surrounded by ancient temples.",Only hyper-velocity impact crater in basaltic rock on Earth.,"Visit Daitya Sudan temple, birdwatching, nature walks.",150 km from Aurangabad; nearest railhead is Jalna.,Some uneven terrain; basic facilities.,August-October,"MTDC resort, local lodges.","Kharvas, puran poli.",Annual Mahashivratri fair.
Kaas Plateau,Maharashtra,Natural,"UNESCO World Natural Heritage Site, known as the 'Valley of Flowers of Maharashtra'.",Carpet of wildflowers blooms after monsoon.,"Photography, nature walks, visit nearby Vajrai Waterfall.",25 km from Satara; nearest airport is Pune.,Not suitable for wheelchair users; short walks.,July-October for full flow,Homestays in Satara.,"Misal pav, sabudana vada.",Kaas Flower Festival.
Chitrakote Falls,Chhattisgarh,Natural,"India's widest waterfall, called the 'Niagara of India', on the Indravati River.",Spectacular horseshoe-shaped falls in dense forest.,"Boat rides, photography, visit nearby tribal villages.",40 km from Jagdalpur; nearest airport is Raipur.,Some steps; not wheelchair accessible.,June-September,"Tourist cottages, forest rest houses.","Chana sagra, fara, tribal mahua liquor.",Bastar Dussehra (September-October).
Tso Moriri,Ladakh,Natural,"High-altitude lake at 4,522 m, less visited than Pangong, in Changthang plateau.","Pristine blue lake, migratory birds, Changpa nomads.","Photography, bird watching, visit Korzok Monastery.",220 km from Leh; self-drive or taxi; permits required.,High altitude; not for elderly or those with health issues.,October-March,"Tented camps, homestays in Korzok.","Yak cheese, thukpa, tsampa.",Korzak Gustor Festival.
Dholavira,Gujarat,Cultural,"One of the five largest Harappan sites in the world, located in the Rann of Kutch.",Ancient city ruins with sophisticated water management.,"Explore archaeological site, fossil park, sunset at White Rann.",220 km from Bhuj; nearest airport is Bhuj.,Some uneven terrain; basic facilities.,November-February,"Tourist cottages, tented camps.","Kutchi dabeli, bajra roti.",Rann Utsav (Nov-Feb).
Sualkuchi,Assam,Cultural,"Known as the 'Manchester of Assam', this village is famed for its centuries-old silk weaving tradition.","Traditional looms in every house, Muga and Eri silk production.","Weaving workshops, buy handloom sarees, interact with artisans.",35 km from Guwahati; local buses and taxis available.,Good for all ages; village roads.,October-May,"Homestays, guest lodges.","Assamese thali, fish tenga.",Bihu celebrations.
Khonoma,Nagaland,Cultural,"India's first green village, famous for Angami tribe's conservation efforts and terraced fields.","Community-run eco-tourism, unique forest management.","Village walks, birdwatching, learn about Angami customs.",20 km from Kohima; taxis and shared jeeps available.,Some hilly paths; basic facilities.,October-April,Homestays in village.,"Smoked pork, sticky rice, bamboo shoot curry.",Sekrenyi Festival (February).
Mawlynnong,Meghalaya,Natural,"Awarded 'Asia's Cleanest Village', famous for living root bridges and eco-friendly practices.","Man-made root bridges, spotless streets, matrilineal Khasi culture.","Walk on root bridges, village tour, visit Sky View platform.",80 km from Shillong; taxis and shared vehicles.,Suitable for all ages; some walking.,"April-June, September-October","Homestays, guesthouses.","Jadoh (rice & meat), tungrymbai.",Wangala Festival (November).
Ziro Valley,Arunachal Pradesh,Natural,"UNESCO World Heritage contender, home to Apatani tribe and their unique paddy-cum-fish farming.","Distinctive bamboo and pine forests, Apatani culture.","Trekking, homestays, Ziro Music Festival.","Nearest airport is Jorhat (Assam), then road to Ziro.",Moderate difficulty for elderly; not wheelchair accessible.,November-March,"Homestays, guest houses.","Bamboo shoots with pork, apong (rice beer).",Ziro Music Festival (September).
Keibul Lamjao National Park,Manipur,Natural,"World's only floating national park, home to endangered Sangai deer.",Unique phumdi (floating biomass) ecosystem.,"Boat rides, wildlife spotting, photography.",53 km from Imphal; taxis and buses available.,Some boardwalks; not wheelchair accessible.,June-September,"Homestays, tourist lodges.","Eromba, ngari, bamboo shoot dishes.",Sangai Festival (November).
Phugtal Monastery,Ladakh,Cultural,"A remote cave monastery built into a cliff face, accessible only by foot.","Spectacular architecture, centuries-old Buddhist traditions.","Trek to monastery, interact with monks, meditation.",Trek from Padum (Zanskar Valley); no motorable road.,Difficult trek; not accessible for elderly.,October-March,"Monastery guesthouse, camping.","Tsampa, butter tea.",Annual Gustor Festival.
Bhedaghat,Madhya Pradesh,Natural,Famed for marble rocks rising 100 ft above the Narmada River.,"Dramatic white cliffs, Dhuandhar Falls, boat rides under moonlight.","Boat ride, cable car, visit Chausath Yogini Temple.",23 km from Jabalpur; taxis and buses available.,Some steps; not wheelchair accessible.,September-February,"Hotels in Jabalpur, guesthouses.","Poha, jalebi, dal bafla.",Narmada Mahotsav (January).
Gandikota,Andhra Pradesh,Natural,"Known as the 'Grand Canyon of India', with a 13th-century fort overlooking a deep gorge.",Spectacular red sandstone cliffs on the Pennar River.,"Explore Gandikota Fort, kayaking, camping, photography.",77 km from Kadapa; nearest railhead is Jammalamadugu.,Some rough terrain; not wheelchair accessible.,October-March,"AP Tourism Haritha Resort, camping.","Ragi sangati, natukodi curry.",Gandikota Utsav.
Lepakshi,Andhra Pradesh,Cultural,16th-century temple complex with hanging pillar and giant Nandi statue.,"Vijayanagara architecture, legendary murals.","Explore temple, photography, learn about legends.",120 km from Bengaluru; buses and taxis available.,Temple has steps; partial wheelchair access.,October-March,"Lodges in Hindupur, guesthouses.","Andhra meals, pulihora.",Veerabhadra Swamy Rathotsavam.
Bhimbetka Rock Shelters,Madhya Pradesh,Cultural,"UNESCO World Heritage Site with prehistoric cave paintings dating back 30,000 years.","Ancient art, natural rock formations.","Guided tours, photography, nature walks.",45 km from Bhopal; taxis and buses available.,Some uneven terrain; not wheelchair accessible.,November-February,"Hotels in Bhopal, guesthouses.","Poha, bhutte ka kees.",Tribal festivals.
Chilika Lake,Odisha,Natural,"Asia's largest brackish water lagoon, winter home to millions of migratory birds.","Irrawaddy dolphins, birdwatching, fishing villages.","Boat rides, birdwatching, visit Kalijai Island.",Nearest railhead is Balugaon; 120 km from Bhubaneswar.,Boat rides accessible; some uneven terrain.,June-September,"Eco resorts, OTDC guesthouses.","Chingudi jhola, crab curry.",Makar Sankranti boat festival.
Dzukou Valley,Nagaland,Natural,"Valley on Nagaland-Manipur border, home to rare Dzukou lily.","Rolling hills, seasonal wildflowers, bamboo groves.","Trekking, camping, photography.",Trek from Viswema or Zakhama; nearest airport is Dimapur.,Tough trek; not for elderly or wheelchair users.,October-March,"Basic rest house, camping.","Axone pork, sticky rice.",Hornbill Festival (December).
Bhimbetka Rock Shelters,Madhya Pradesh,Cultural,"UNESCO World Heritage Site with prehistoric cave paintings dating back 30,000 years.","Ancient art, natural rock formations.","Guided tours, photography, nature walks.",45 km from Bhopal; taxis and buses available.,Some uneven terrain; not wheelchair accessible.,November-February,"Hotels in Bhopal, guesthouses.","Poha, bhutte ka kees.",Tribal festivals.
Chettinad,Tamil Nadu,Cultural,Region of palatial mansions and unique Chettiar cuisine.,"Distinctive architecture, antique markets.","Mansion tours, food trails, tile workshops.",Nearest airport is Madurai; 90 km by road.,Most mansions have steps; some accessible rooms.,October-March,"Heritage hotels, homestays.","Chettinad chicken, kuzhi paniyaram.",Kottai Pongal (January).
Araku Valley,Andhra Pradesh,Natural,"Scenic valley in the Eastern Ghats, home to tribal communities and coffee plantations.","Waterfalls, caves, tribal culture.","Train journey from Vizag, coffee museum, Borra Caves.",120 km from Visakhapatnam; train or road.,Some hilly terrain; basic facilities.,October-February,"Resorts, homestays.","Bamboo chicken, tribal thali.",Araku Balloon Festival.
Haflong,Assam,Natural,"Assam's only hill station, known for its scenic beauty, Dimasa culture, and Haflong Lake.","Rolling hills, tribal villages, and orchid gardens.","Boating on Haflong Lake, trekking, visiting Jatinga (famous for bird phenomenon).",Nearest railhead is Haflong Hill; Silchar airport 100 km away.,Good for all ages; some hilly terrain.,June-September,"Haflong Circuit House, local homestays.","Sticky rice, bamboo shoot dishes, fish curry.",Dimasa Baidima Festival.
Gurez Valley,Jammu & Kashmir,Natural,"Remote valley near the Line of Control, home to Dard-Shin tribe and Habba Khatoon peak.","Ancient Shina language, pristine river views.","Trekking, trout fishing, cultural immersion.",123 km from Srinagar; road open May-October.,Not wheelchair accessible; security checks.,June-September,"Homestays, guesthouses.","Trout curry, rajma chawal.",Habba Khatoon Mela.
Dudhsagar Falls,Goa,Natural,"One of India's tallest waterfalls, on the Mandovi River in the Western Ghats.","Spectacular four-tiered waterfall, accessible by train or trek.","Trekking, swimming, photography.",60 km from Panaji; train to Castle Rock or trek from Kulem.,Trek is challenging; not wheelchair accessible.,November-February,"Eco resorts, campsites.","Goan fish curry, bebinca.",Shigmo Festival.
Chandipur Beach,Odisha,Natural,Famous for the 'vanishing sea'-the water recedes up to 5 km during low tide.,"Unique tidal phenomenon, horseshoe crab sightings.","Beach walks, seafood, shell collecting.",16 km from Balasore; nearest railhead is Balasore.,Beach accessible; some sandy areas.,October-February,"OTDC Panthanivas, local hotels.","Chingudi malai curry, rasgulla.",Chandipur Beach Festival.
St. Mary's Islands,Karnataka,Natural,Cluster of four small islands with unique hexagonal basaltic rock formations.,"Columnar lava formations, white sand beaches.","Ferry ride, photography, shell collecting.",Ferry from Malpe (Udupi); nearest airport is Mangalore.,Ferry access only; not wheelchair accessible.,October-March,Hotels in Malpe/Udupi.,"Mangalorean seafood, neer dosa.",Malpe Beach Festival.
Dhanushkodi,Tamil Nadu,Natural,"Abandoned town at the tip of Rameswaram island, destroyed in 1964 cyclone.","Ghost town, mythological Ramayana connection.","Visit ruins, Adam's Bridge viewpoint, birdwatching.",20 km from Rameswaram; local jeeps only.,Sandy terrain; not wheelchair accessible.,October-April,Hotels in Rameswaram.,"Fish fry, idiyappam.",Karthigai Deepam.
Mawphlang Sacred Grove,Meghalaya,Natural,"Ancient forest protected by Khasi tribes for centuries, rich in biodiversity and folklore.",No tree or stone can be removed; unique flora.,"Guided forest walks, learn Khasi rituals.",25 km from Shillong; taxis available.,Forest trails; not wheelchair accessible.,November-March,Homestays in Mawphlang.,"Jadoh, pork with bamboo shoot.",Shad Suk Mynsiem (April).
Krem Liat Prah,Meghalaya,Natural,"India's longest natural cave system, over 30 km explored.","Stunning stalactites, underground rivers.","Caving (with guides), photography.","Near Nongjri village, 60 km from Shillong.",Physically demanding; not for elderly or those with claustrophobia.,December-March,Homestays in Nongjri.,Rice and pork dishes.,Caving expeditions.
Auli,Uttarakhand,Natural,High-altitude ski resort with panoramic views of Nanda Devi and other peaks.,"Best ski slopes in India, cable car rides.","Skiing, trekking, chair lift, camping.",16 km from Joshimath; cable car from Joshimath.,Skiing requires fitness; cable car accessible.,,"Ski resorts, GMVN guesthouses.","Aloo ke gutke, chainsoo.",Auli Winter Carnival.