state,name,initiatives,type,accessibility_rating,accessibility_info,food,food_info,travel,travel_info,unique_info,history,activities,accomodation,events
Jammu & Kashmir,Gurez Valley,,Natural,Moderate,Not wheelchair accessible; security checks.,NV,"Trout curry, rajma chawal.",Difficult,123 km from Srinagar; road open May-October.,"Ancient Shina language, pristine river views.","Remote valley near the Line of Control, home to Dard-Shin tribe and Habba Khatoon peak.","Trekking, trout fishing, cultural immersion.","Homestays, guesthouses.",Habba Khatoon Mela.
Goa,Dudhsagar Falls,,Natural,Moderate,Trek is challenging; not wheelchair accessible.,NV,"Goan fish curry, bebinca.",Moderate,60 km from Panaji; train to Castle Rock or trek from Kulem.,"Spectacular four-tiered waterfall, accessible by train or trek.","One of India's tallest waterfalls, on the Mandovi River in the Western Ghats.","Trekking, swimming, photography.","Eco resorts, campsites.",Shigmo Festival.
Odisha,Chandipur Beach,,Natural,Moderate,Beach accessible; some sandy areas.,NV,"Chingudi malai curry, rasgulla.",Easy,16 km from Balasore; nearest railhead is Balasore.,"Unique tidal phenomenon, horseshoe crab sightings.",Famous for the 'vanishing sea'-the water recedes up to 5 km during low tide.,"Beach walks, seafood, shell collecting.","OTDC Panthanivas, local hotels.",Chandipur Beach Festival.
Karnataka,St. Mary's Islands,,Natural,Moderate,Ferry access only; not wheelchair accessible.,NV,"Mangalorean seafood, neer dosa.",Moderate,Ferry from Malpe (Udupi); nearest airport is Mangalore.,"Columnar lava formations, white sand beaches.",Cluster of four small islands with unique hexagonal basaltic rock formations.,"Ferry ride, photography, shell collecting.",Hotels in Malpe/Udupi.,Malpe Beach Festival.
Tamil Nadu,Dhanushkodi,,Natural,Moderate,Sandy terrain; not wheelchair accessible.,NV,"Fish fry, idiyappam.",Moderate,20 km from Rameswaram; local jeeps only.,"Ghost town, mythological Ramayana connection.","Abandoned town at the tip of Rameswaram island, destroyed in 1964 cyclone.","Visit ruins, Adam's Bridge viewpoint, birdwatching.",Hotels in Rameswaram.,Karthigai Deepam.
Meghalaya,Mawphlang Sacred Grove,,Natural,Not Accessible,Forest trails; not wheelchair accessible.,NV,"Jadoh, pork with bamboo shoot.",Easy,25 km from Shillong; taxis available.,No tree or stone can be removed; unique flora.,"Ancient forest protected by Khasi tribes for centuries, rich in biodiversity and folklore.","Guided forest walks, learn Khasi rituals.",Homestays in Mawphlang.,Shad Suk Mynsiem (April).
Meghalaya,Krem Liat Prah,,Natural,Not Accessible,Physically demanding; not for elderly or those with claustrophobia.,NV,Rice and pork dishes.,Moderate,"Near Nongjri village, 60 km from Shillong.","Stunning stalactites, underground rivers.","India's longest natural cave system, over 30 km explored.","Caving (with guides), photography.",Homestays in Nongjri.,Caving expeditions.
Uttarakhand,Auli,,Natural,Moderate,Skiing requires fitness; cable car accessible.,NV,"Aloo ke gutke, chainsoo.",Moderate,16 km from Joshimath; cable car from Joshimath.,"Best ski slopes in India, cable car rides.",High-altitude ski resort with panoramic views of Nanda Devi and other peaks.,"Skiing, trekking, chair lift, camping.","Ski resorts, GMVN guesthouses.",Auli Winter Carnival.
