state,name,initiatives,type,accessibility_rating,accessibility_info,food,food_info,travel,travel_info,unique_info,history,activities,accomodation,events
Kerala,Cholanaickan Tribal Settlement,"- Eco-tourism development by Kerala Forest Dept & responsible tourism with focus on tribal communities and sustainable resource management.- Forest conservation programs securing forest carbon sinks.- Tribal welfare schemes promoting sustainable livelihoods, indirectly reducing forest resource pressure.",Cultural,Not Accessible,Not suitable for elderly or wheelchair users; visits only with official permission and guides; not for independent travelers.,V,"Traditional tribal food includes tubers, wild honey, bamboo rice, and foraged greens",Easy,"60 km from Nilambur, Kerala. Nearest airport is Kozhikode; nearest railway station is Nilambur Road.",One of the last hunter-gatherer communities in South India with extensive knowledge of medicinal plants. Their language is unique and not written down.,Home to one of India's most isolated tribes who lived in caves until recently. They are master honey gatherers and forest knowledge experts.,Guided visits to forest periphery with tribal guides; learning about honey collection; medicinal plant walks; cultural exchange programs through government-sanctioned tribal welfare initiatives.,No accommodations in tribal areas; stay in Nilambur or nearby areas,No public festivals; occasional cultural programs organized by Tribal Department
Arunachal Pradesh,Dong Village,- Arunachal Pradesh Forest Department afforestation and forest protection programs.- Community-based eco-tourism involving locals and promoting sustainable environmental practices.,Natural,Not Accessible,Challenging for elderly and not wheelchair accessible; inner line permits required; guided tours essential.,NV,Thukpa; momos; local rice preparations; fermented bamboo shoot dishes; butter tea,Difficult,50 km from Walong. Nearest airport is Dibrugarh (connection via road/helicopter); permits required for all visitors.,First place in India to receive sunlight each morning (around 5:30 AM). Traditional Meyor tribe settlement with unique cultural practices influenced by Tibetan Buddhism.,"Easternmost village in India where the sun rises first in the country. Located near the tri-junction of India, China, and Myanmar borders.",Experience India's earliest sunrise; village walks; photography; bird watching; learning about Meyor culture; trekking along nearby hills; visit to Dong Monastery.,Basic homestays in the village; government inspection bungalow with prior booking,Buddhist festivals following Tibetan calendar; Losar celebrations
Arunachal Pradesh,Ziro Valley,"- Ziro Festival of Music with sustainability focus (waste management, local culture promotion).- Apatani cultural landscape preservation (sustainable agriculture).- Forest Dept projects for forest cover and reforestation.",Natural,Moderate,Moderate difficulty for elderly; not wheelchair accessible; safe for solo travelers with basic precautions.,NV,Bamboo shoots with pork; fermented rice beer (apong); smoked meat dishes; fish from paddy fields,Moderate,Nearest airport is Jorhat (Assam) 4 hours away. Helicopter service from Naharlagun to Ziro. Train to Naharlagun then taxi to Ziro.,One of India's few rice-cum-fish cultivation systems. The valley has distinctive bamboo and pine forests with picturesque villages.,Home to the Apatani tribe known for their unique face tattoos and nose plugs. UNESCO World Heritage Site contender.,Trekking in the valley floor; attending Ziro Music Festival (September); photography of paddy fields; homestay with Apatani tribe; exploring Talley Valley Wildlife Sanctuary.,Homestays in traditional Apatani houses; Ziro Valley Resort; few guest houses in Old Ziro and New Ziro,Ziro Music Festival (September); Myoko Festival (March); Dree Festival (July)
Assam,Majuli Island,- Riverbank erosion control projects involving afforestation.- Wetland conservation efforts.- Cultural landscape conservation by NGOs focusing on traditional way of life and environment.,Cultural,Moderate,Limited accessibility for disabled visitors; senior-friendly with assistance; safe for solo travelers.,NV,Assamese thalis with fresh fish; poitabhat (fermented rice); duck meat with ash gourd,Moderate,Ferry from Nimati Ghat (Jorhat) to Kamalabari Ghat. Nearest airport is Jorhat; nearest railway station is Jorhat.,Unique tradition of mask-making at Samaguri Satra. The island is gradually eroding due to the Brahmaputra river and may disappear in coming decades.,World's largest river island on the Brahmaputra. Center of Assamese neo-Vaishnavite culture with ancient monasteries (satras) dating back to the 15th century.,Visit ancient satras (monasteries); watch mask-making process; bicycle around the island; boat rides on the Brahmaputra; bird watching during winter; cultural performances at satras.,La Maison de Ananda; Me:Po Okum; Deka Chang; numerous homestays,Raas Leela (November); Paal Naam performances at satras; Ali-Ai-Ligang (February)
Gujarat,Champaner-Pavagadh Archaeological Park,- ASI conservation and maintenance with sustainable site management.- Visitor management efforts to minimize impact on structures and environment.,Cultural,Accessible,Moderately accessible for elderly; partial wheelchair access in main monuments; solo travel friendly.,V,Gujarati thali; dhokla; khandvi; dal dhokli available in nearby small eateries,Easy,57 km from Vadodara. Nearest airport and railway station is Vadodara.,Only complete unchanged pre-Mughal Islamic city in India. Contains ruins from multiple periods showcasing evolution of architectural styles over 600 years.,UNESCO World Heritage Site with structures dating from the 8th to 14th centuries. Ancient Hindu and Jain temples along with Islamic monuments.,Explore Jami Masjid; hike to Pavagadh Hill and Kalika Mata Temple; visit the step wells; photography of ancient structures; archeological explorations of lesser-known ruins.,Limited options near the site. Best to stay in Vadodara and make a day trip.,Navratri celebrations at Kalika Mata Temple (September/October)
Tripura,Unakoti,- ASI protection and maintenance of rock carvings.- Tripura tourism development with cleanliness and green cover efforts.- Forest conservation and afforestation drives.,Cultural,Not Accessible,Challenging for elderly and wheelchair users due to hillside location and steps; reasonable for solo travelers.,NV,Traditional Tripuri cuisine; bamboo shoot preparations; berma (fermented fish); chuak (rice beer),Moderate,178 km from Agartala. Nearest railhead is Kumarghat (20 km). Nearest airport is Agartala.,Features massive 30-foot high bas-relief carvings on a hillside. Legend says these are divine artisans turned to stone after failing to create a crore sculptures in one night.,Rock-cut sculptures and stone images from 7th-9th centuries depicting Lord Shiva and other Hindu deities. The name means 'one less than a crore' in Bengali.,Explore the massive rock carvings; photography; meditation in the serene environment; hiking around the forested area; visit nearby waterfalls.,Limited accommodations in Kailashahar (12 km away); better options in Agartala,Ashokastami Festival (April) when thousands of pilgrims visit
Ladakh,Hemis National Park,- Snow leopard conservation programs by NGOs and Forest Dept.- Eco-tourism & homestay initiatives promoting sustainable practices.- Waste management campaigns for fragile ecosystem protection.,Natural,Moderate,Not suitable for elderly or wheelchair users; moderate to difficult trekking; experienced solo travelers only with guides.,NV,Thukpa; skyu; chhutagi; butter tea; chang (barley beer),Moderate,40 km from Leh. Nearest airport is Leh. Entry through organized tours only with permits.,One of the best places in the world to spot the elusive snow leopard. Also houses ancient monasteries amid stunning high-altitude Himalayan landscapes.,Largest national park in South Asia and home to the endangered snow leopard. Established in 1981 but the area has ancient Buddhist connections.,Wildlife spotting (snow leopards from Jan-Mar); trekking; visit to Hemis Monastery; photography; homestay in traditional Ladakhi houses in Rumbak village.,Homestays in Rumbak village; camping during treks; no luxury accommodations inside the park,Hemis Festival at Hemis Monastery (June/July)
Tamil Nadu,Chettinad,"- Heritage conservation and restoration using traditional sustainable building methods.- Responsible tourism development preserving customs and artisan livelihoods.- Promotion of local crafts (tiles, textiles, jewelry) sustainably.",Cultural,Moderate,Suitable for elderly with assistance; limited wheelchair accessibility in old mansions; safe for solo travelers.,Both,Chettinad chicken/mutton; Kavuni arisi (black rice pudding); paniyaram; vegetable kothu; kuzhi paniyaram,Moderate,Nearest airport is Madurai (90 km); nearest railway station is Karaikudi.,"Mansions built with materials from around the world including Italian marble, Japanese tiles, and Burmese teak. Unique architectural style blending Western and Eastern influences.",Historical region known for the palatial houses of the wealthy Nattukottai Chettiar merchant community who traded across Southeast Asia.,Mansion tours in Karaikudi; antique shopping; Chettinad cuisine experiences; photography of architectural details; tile-making workshops; temple visits.,The Bangala; Visalam; Chidambara Vilas; Chettinadu Mansion - all heritage hotels converted from original mansions,Kothaipongal (January); local temple festivals throughout year
Nagaland,Dzukou Valley,- Forest fire prevention through local awareness and fire line cutting.- Sustainable trekking guidelines.- Community-led conservation based on indigenous practices.,Natural,Not Accessible,Challenging for elderly and not wheelchair accessible; experienced trekkers recommended; guided tours advisable for solo travelers.,NV,Smoked pork with bamboo shoot; axone (fermented soybean); zutho (rice beer); fish cooked in bamboo,Difficult,Trek starts from Viswema or Zakhama village. Nearest airport and railway station is Dimapur (100 km from Kohima).,Famous for its seasonal burst of lilies and rare Dzukou lily found nowhere else in the world. Features uniquely sculpted valleys and rolling hills with dwarf bamboo patches.,Valley on the border of Nagaland and Manipur at an altitude of 2450m. Traditional territory of the Angami Naga tribe.,Trekking; camping; photography especially during lily season (May-September); botanizing; star gazing; experiencing Naga culture in nearby villages.,Basic accommodations at rest house in the valley; camping; better options in Kohima,Hornbill Festival (December) in nearby Kohima; Sekrenyi Festival (February)
Jammu & Kashmir,Gurez Valley,- Sustainable tourism development by J&K Tourism Department.- State forest protection programs covering sensitive border regions.,Natural,Moderate,Not suitable for elderly or wheelchair users; requires security clearances as it's near LOC; solo travel possible but challenging.,NV,Gurez trout preparations; rajma-chawal; noon chai (salt tea); traditional Dard-Shin dishes,Difficult,123 km from Srinagar. Nearest airport is Srinagar. Road access only during summer months (May-October).,One of the few places where the ancient Shina language is still spoken. Spectacular views of snow-capped Habba Khatoon peak and the Kishanganga River.,Remote valley near the Line of Control that was closed to tourists until recently. Inhabited by the Dard-Shin tribe who have preserved their unique culture.,Trout fishing in Kishanganga River; trekking to Tulail Valley; visiting ancient Habba Khatoon tower; photography; cultural exploration of Dard-Shin traditions; homestays.,J&K Tourism guest house; homestays in Dawar village; camping options,Local folk dance performances in summer; Peer Baba festival at Habba Khatoon shrine
Arunachal Pradesh,Mechuka Valley,- Eco-tourism policies minimizing environmental impact.- Border area development programs with sustainable infrastructure principles.,Natural,Moderate,Not wheelchair accessible; basic facilities only.,NV,"Momo, thukpa, local millet beer.",Difficult,"Nearest airport is Dibrugarh (Assam), then 7-8 hr drive. Permits required.","Pristine landscapes, wooden houses, and a unique blend of Buddhist and tribal cultures.","A remote valley near the Indo-Tibet border, home to the Memba tribe and a 400-year-old Buddhist monastery.","Trekking, monastery visits, river rafting, explore local villages.",Homestays and guesthouses in Mechuka town.,Losar (Tibetan New Year) celebrations.
Assam,Haflong,- Urban greening and tree plantation drives.- Solid waste management and cleanliness initiatives.- Conservation efforts for Haflong Lake.,Natural,Moderate,Good for all ages; some hilly terrain.,NV,"Sticky rice, bamboo shoot dishes, fish curry.",Moderate,Nearest railhead is Haflong Hill; Silchar airport 100 km away.,"Rolling hills, tribal villages, and orchid gardens.","Assam's only hill station, known for its scenic beauty, Dimasa culture, and Haflong Lake.","Boating on Haflong Lake, trekking, visiting Jatinga (famous for bird phenomenon).","Haflong Circuit House, local homestays.",Dimasa Baidima Festival.
Arunachal Pradesh,Tawang Monastery,- Continuous maintenance and preservation using sustainable building practices.- Solar power initiatives.- Regular cleanliness drives by local groups.,Cultural,Moderate,Not wheelchair accessible; high altitude.,NV,"Thenthuk, butter tea, yak cheese.",Difficult,"Nearest airport is Tezpur, then 12 hr drive; permits required.","Spectacular hilltop setting, rich monastic traditions.","Largest monastery in India, founded in the 17th century. Center of Mahayana Buddhism in the region.","Attend morning prayers, explore museum, trek to nearby lakes.","Monastery guesthouse, local hotels.",Torgya Festival (January).
West Bengal,Sandakphu,- Singalila National Park flora and fauna management.- Eco-tourism regulations for homestays and trekking agencies.- Community-based waste management along trekking routes.,Natural,Moderate,Not suitable for elderly or wheelchair users.,NV,"Darjeeling tea, momos.",Difficult,Trek from Manebhanjan (near Darjeeling); nearest airport is Bagdogra.,"Only place in India to see Everest, Kanchenjunga, Lhotse, and Makalu together.","Highest peak in West Bengal, part of Singalila Ridge, offering panoramic views of four of the world's five highest peaks.","Trekking, rhododendron watching, birding.","Tea houses, trekkers' huts.",Local Lepcha festivals.
Uttarakhand,Chopta,"- ""No Plastic"" zones enforcement.- Forest protection by Uttarakhand Forest Dept.- Local NGO-led waste management drives.",Natural,Moderate,"Basic guesthouses, some tented camps.",V,"Aloo ke gutke, mandua roti.",Moderate,Drive from Rishikesh/Haridwar (200 km); nearest railhead is Haridwar.,"Alpine meadows, rhododendron forests, and Himalayan views.","Known as the 'Mini Switzerland of India', Chopta is the base for the Tungnath trek, the highest Shiva temple.","Trekking to Tungnath and Chandrashila, camping, bird watching.","Guesthouses in Chopta, camping.",Butter Festival (August).
Uttarakhand,Chakrata,- Forest protection and afforestation programs.- Waste management improvements by municipal bodies.- Responsible tourism promotion with guidelines.,Natural,Moderate,Good for families; some sites require trekking.,V,"Kandali ka saag, local rajma.",Moderate,100 km from Dehradun; nearest airport is Jolly Grant.,Secluded hill station with ancient caves and waterfalls.,"A cantonment town established by the British, surrounded by deodar forests.","Visit Tiger Falls, Deoban, Budher Caves, trekking.","Forest rest houses, homestays.",Magh Mela.
Maharashtra,Lonar Crater,- Conservation of unique lake ecosystem by Forest Dept and NGOs.- Geological heritage site protection.- Local cleanliness drives.,Natural,Accessible,Some uneven terrain; basic facilities.,V,"Kharvas, puran poli.",Moderate,150 km from Aurangabad; nearest railhead is Jalna.,Only hyper-velocity impact crater in basaltic rock on Earth.,"A 52,000-year-old meteorite crater lake, surrounded by ancient temples.","Visit Daitya Sudan temple, birdwatching, nature walks.","MTDC resort, local lodges.",Annual Mahashivratri fair.
Maharashtra,Kaas Plateau,- UNESCO World Heritage management including biodiversity conservation.- Visitor management to minimize ecosystem impact.- Ongoing biodiversity research and protection.,Natural,Moderate,Not suitable for wheelchair users; short walks.,V,"Misal pav, sabudana vada.",Easy,25 km from Satara; nearest airport is Pune.,Carpet of wildflowers blooms after monsoon.,"UNESCO World Natural Heritage Site, known as the 'Valley of Flowers of Maharashtra'.","Photography, nature walks, visit nearby Vajrai Waterfall.",Homestays in Satara.,Kaas Flower Festival.
Chhattisgarh,Chitrakote Falls,- Tourism Board promotion emphasizing sustainability.- Local cleanliness initiatives.- River conservation efforts in Indravati River basin.,Natural,Moderate,Some steps; not wheelchair accessible.,Both,"Chana sagra, fara, tribal mahua liquor.",Moderate,40 km from Jagdalpur; nearest airport is Raipur.,Spectacular horseshoe-shaped falls in dense forest.,"India's widest waterfall, called the 'Niagara of India', on the Indravati River.","Boat rides, photography, visit nearby tribal villages.","Tourist cottages, forest rest houses.",Bastar Dussehra (September-October).
Ladakh,Tso Moriri,- Ramsar wetland conservation reserve with Wildlife Dept and community involvement.- Responsible tourism guidelines.- Community-based conservation involving Changpa nomads.,Natural,Moderate,High altitude; not for elderly or those with health issues.,NV,"Yak cheese, thukpa, tsampa.",Difficult,220 km from Leh; self-drive or taxi; permits required.,"Pristine blue lake, migratory birds, Changpa nomads.","High-altitude lake at 4,522 m, less visited than Pangong, in Changthang plateau.","Photography, bird watching, visit Korzok Monastery.","Tented camps, homestays in Korzok.",Korzak Gustor Festival.
Gujarat,Dholavira,,Cultural,Moderate,Some uneven terrain; basic facilities.,V,"Kutchi dabeli, bajra roti.",Moderate,220 km from Bhuj; nearest airport is Bhuj.,Ancient city ruins with sophisticated water management.,"One of the five largest Harappan sites in the world, located in the Rann of Kutch.","Explore archaeological site, fossil park, sunset at White Rann.","Tourist cottages, tented camps.",Rann Utsav (Nov-Feb).
Assam,Sualkuchi,,Cultural,Moderate,Good for all ages; village roads.,NV,"Assamese thali, fish tenga.",Easy,35 km from Guwahati; local buses and taxis available.,"Traditional looms in every house, Muga and Eri silk production.","Known as the 'Manchester of Assam', this village is famed for its centuries-old silk weaving tradition.","Weaving workshops, buy handloom sarees, interact with artisans.","Homestays, guest lodges.",Bihu celebrations.
Nagaland,Khonoma,,Cultural,Not Accessible,Some hilly paths; basic facilities.,NV,"Smoked pork, sticky rice, bamboo shoot curry.",Easy,20 km from Kohima; taxis and shared jeeps available.,"Community-run eco-tourism, unique forest management.","India's first green village, famous for Angami tribe's conservation efforts and terraced fields.","Village walks, birdwatching, learn about Angami customs.",Homestays in village.,Sekrenyi Festival (February).
Meghalaya,Mawlynnong,,Natural,Moderate,Suitable for all ages; some walking.,NV,"Jadoh (rice & meat), tungrymbai.",Moderate,80 km from Shillong; taxis and shared vehicles.,"Man-made root bridges, spotless streets, matrilineal Khasi culture.","Awarded 'Asia's Cleanest Village', famous for living root bridges and eco-friendly practices.","Walk on root bridges, village tour, visit Sky View platform.","Homestays, guesthouses.",Wangala Festival (November).
Arunachal Pradesh,Ziro Valley,"- Ziro Festival of Music with sustainability focus (waste management, local culture promotion).- Apatani cultural landscape preservation (sustainable agriculture).- Forest Dept projects for forest cover and reforestation.",Natural,Not Accessible,Moderate difficulty for elderly; not wheelchair accessible.,NV,"Bamboo shoots with pork, apong (rice beer).",Moderate,"Nearest airport is Jorhat (Assam), then road to Ziro.","Distinctive bamboo and pine forests, Apatani culture.","UNESCO World Heritage contender, home to Apatani tribe and their unique paddy-cum-fish farming.","Trekking, homestays, Ziro Music Festival.","Homestays, guest houses.",Ziro Music Festival (September).
Manipur,Keibul Lamjao National Park,,Natural,Moderate,Some boardwalks; not wheelchair accessible.,NV,"Eromba, ngari, bamboo shoot dishes.",Easy,53 km from Imphal; taxis and buses available.,Unique phumdi (floating biomass) ecosystem.,"World's only floating national park, home to endangered Sangai deer.","Boat rides, wildlife spotting, photography.","Homestays, tourist lodges.",Sangai Festival (November).
Ladakh,Phugtal Monastery,,Cultural,Moderate,Difficult trek; not accessible for elderly.,V,"Tsampa, butter tea.",Difficult,Trek from Padum (Zanskar Valley); no motorable road.,"Spectacular architecture, centuries-old Buddhist traditions.","A remote cave monastery built into a cliff face, accessible only by foot.","Trek to monastery, interact with monks, meditation.","Monastery guesthouse, camping.",Annual Gustor Festival.
Madhya Pradesh,Bhedaghat,,Natural,Accessible,Some steps; not wheelchair accessible.,NV,"Poha, jalebi, dal bafla.",Easy,23 km from Jabalpur; taxis and buses available.,"Dramatic white cliffs, Dhuandhar Falls, boat rides under moonlight.",Famed for marble rocks rising 100 ft above the Narmada River.,"Boat ride, cable car, visit Chausath Yogini Temple.","Hotels in Jabalpur, guesthouses.",Narmada Mahotsav (January).
Andhra Pradesh,Gandikota,,Natural,Moderate,Some rough terrain; not wheelchair accessible.,V,"Ragi sangati, natukodi curry.",Moderate,77 km from Kadapa; nearest railhead is Jammalamadugu.,Spectacular red sandstone cliffs on the Pennar River.,"Known as the 'Grand Canyon of India', with a 13th-century fort overlooking a deep gorge.","Explore Gandikota Fort, kayaking, camping, photography.","AP Tourism Haritha Resort, camping.",Gandikota Utsav.
Andhra Pradesh,Lepakshi,,Cultural,Accessible,Temple has steps; partial wheelchair access.,V,"Andhra meals, pulihora.",Moderate,120 km from Bengaluru; buses and taxis available.,"Vijayanagara architecture, legendary murals.",16th-century temple complex with hanging pillar and giant Nandi statue.,"Explore temple, photography, learn about legends.","Lodges in Hindupur, guesthouses.",Veerabhadra Swamy Rathotsavam.
Madhya Pradesh,Bhimbetka Rock Shelters,,Cultural,Accessible,Some uneven terrain; not wheelchair accessible.,NV,"Poha, bhutte ka kees.",Easy,45 km from Bhopal; taxis and buses available.,"Ancient art, natural rock formations.","UNESCO World Heritage Site with prehistoric cave paintings dating back 30,000 years.","Guided tours, photography, nature walks.","Hotels in Bhopal, guesthouses.",Tribal festivals.
Odisha,Chilika Lake,,Natural,Moderate,Boat rides accessible; some uneven terrain.,NV,"Chingudi jhola, crab curry.",Moderate,Nearest railhead is Balugaon; 120 km from Bhubaneswar.,"Irrawaddy dolphins, birdwatching, fishing villages.","Asia's largest brackish water lagoon, winter home to millions of migratory birds.","Boat rides, birdwatching, visit Kalijai Island.","Eco resorts, OTDC guesthouses.",Makar Sankranti boat festival.
Nagaland,Dzukou Valley,,Natural,Not Accessible,Tough trek; not for elderly or wheelchair users.,V,"Axone pork, sticky rice.",Difficult,Trek from Viswema or Zakhama; nearest airport is Dimapur.,"Rolling hills, seasonal wildflowers, bamboo groves.","Valley on Nagaland-Manipur border, home to rare Dzukou lily.","Trekking, camping, photography.","Basic rest house, camping.",Hornbill Festival (December).
Madhya Pradesh,Bhimbetka Rock Shelters,,Cultural,Accessible,Some uneven terrain; not wheelchair accessible.,NV,"Poha, bhutte ka kees.",Easy,45 km from Bhopal; taxis and buses available.,"Ancient art, natural rock formations.","UNESCO World Heritage Site with prehistoric cave paintings dating back 30,000 years.","Guided tours, photography, nature walks.","Hotels in Bhopal, guesthouses.",Tribal festivals.
Tamil Nadu,Chettinad,,Cultural,Moderate,Most mansions have steps; some accessible rooms.,NV,"Chettinad chicken, kuzhi paniyaram.",Moderate,Nearest airport is Madurai; 90 km by road.,"Distinctive architecture, antique markets.",Region of palatial mansions and unique Chettiar cuisine.,"Mansion tours, food trails, tile workshops.","Heritage hotels, homestays.",Kottai Pongal (January).
Andhra Pradesh,Araku Valley,,Natural,Moderate,Some hilly terrain; basic facilities.,NV,"Bamboo chicken, tribal thali.",Moderate,120 km from Visakhapatnam; train or road.,"Waterfalls, caves, tribal culture.","Scenic valley in the Eastern Ghats, home to tribal communities and coffee plantations.","Train journey from Vizag, coffee museum, Borra Caves.","Resorts, homestays.",Araku Balloon Festival.
Assam,Haflong,,Natural,Moderate,Good for all ages; some hilly terrain.,NV,"Sticky rice, bamboo shoot dishes, fish curry.",Moderate,Nearest railhead is Haflong Hill; Silchar airport 100 km away.,"Rolling hills, tribal villages, and orchid gardens.","Assam's only hill station, known for its scenic beauty, Dimasa culture, and Haflong Lake.","Boating on Haflong Lake, trekking, visiting Jatinga (famous for bird phenomenon).","Haflong Circuit House, local homestays.",Dimasa Baidima Festival.
